{
  "taskId": "example-calendar-task",
  "runtime": "subagent",
  "taskKind": "detached-agent",
  "requesterSessionKey": "agent:main:discord:channel:example-calendar",
  "ownerKey": "agent:main:discord:channel:example-calendar",
  "scopeKind": "session",
  "childSessionKey": "agent:main:subagent:example-child",
  "task": "Add today\u2019s Company Alpha and Company Beta calls to Work Calendar.",
  "status": "succeeded",
  "deliveryStatus": "pending",
  "notifyPolicy": "done_only",
  "createdAt": 1790000000000,
  "startedAt": 1790000001000,
  "endedAt": 1790000300000,
  "terminalSummary": "Existing entries updated and read back; requester delivery remains pending.",
  "terminalOutcome": "succeeded"
}
